Feature	Number of Genes	Genes
protein binding	235	WDR59, CIAO3, CCNB1, PPP2R2C, TUSC2, CHP1, CTPS1, TLE3, BLTP3A, ARL4C, CCT3, FAT4, LONP1, BABAM2, DOK3, GNA12, MLLT10, GPSM2, FBXO45, GNG2, MFAP4, GNAS, DIAPH1, UNC45B, CDC73, CAPZA2, DCTN2, SH3BP1, RAP1GDS1, FARP1, RIOK1, USP15, TRAPPC6B, ARPC1B, SH2D4A, GIGYF2, IFT81, DPP9, STAT1, RNF146, OSBPL2, DBNL, UBE2D3, RPAP2, DSN1, MIOS, SKIC3, SKIC8, VBP1, RABGEF1, BTF3L4, BBS4, STOM, AP3D1, CDPF1, PRPSAP1, RNF31, HDDC3, VCP, ZNF213, SNX9, RABEP2, MARK4, OSTF1, FSD2, GSK3A, MYO9B, AAR2, MAP2K2, AIP, ELP1, CCDC43, ERC1, ZNF598, USP25, DAPK3, EIF2S2, SORBS3, CAMK2D, SKA3, PIDD1, TRIM11, SNX11, RPL23, ZNF263, EIF4A2, YJU2B, CAP1, SPDL1, PSMF1, PNMA1, SCGN, CDK3, OTUD4, LURAP1, NAA10, RRAS, HBS1L, NAA16, EPS8L1, CAPN1, TSPYL5, ATXN2L, KIAA0753, UBAP2, EIF4G3, EPRS1, CRYGD, ZNF785, WDR26, TLN2, VWA8, RAPGEF6, CAMKK1, MVP, CAPN2, CORO2A, MRTFA, PPP6R2, CSNK1A1, PARD6B, IKBKB, AFG2A, PSAT1, FGF13, SAPCD2, EPS15, USP10, STIL, PSME1, PASK, ZNRD2, PIP4K2C, LARP1B, TPRKB, MRAS, ABCE1, LAMTOR5, MON1B, RABGAP1, OPTN, CAPNS2, CAMK2B, AMOTL1, WDR83, DIXDC1, ZC3HAV1, DNAJB9, CCDC103, CCHCR1, RFPL4A, SH3KBP1, DOK4, SHC1, FAM83G, ATXN2, QARS1, TYK2, LRRC4C, NUMB, CALCOCO1, CCDC6, LRRC73, CRYAB, INTS10, FHIP1A, MAP4K5, AHCYL1, VPS11, BBC3, METTL13, AIRIM, MORC2, PER3, MSI2, IMPDH2, SARS1, LRCH3, TACC3, IKBKG, MAGEA1, AMPD2, IKBKE, BFSP2, SPAG5, HSP90AA1, FTSJ1, CIT, FXR2, LDHA, RABL6, CAMSAP2, TRIM39, EIF4A1, DAAM1, TRAF2, PRRC2A, NCAPH, PSMD9, FAM83H, PRPSAP2, BUB1B, KCTD21, EIF3E, EIF3I, PUM2, RBMS1, STAT5A, SPC25, SYCE1, ZFYVE9, TSC22D4, PIH1D1, RPAP3, CCT2, PFDN5, PFDN1, MOV10, CCT6A, CCT7, SHB, PDCL3, PDCD5, PDCL, TXNDC9, CCT8, CCT4, NLRP2, EIF3B, EIF3C, EIF3D, EIF3H, EIF3J, EIF3K, EIF3M
cytosol	199	WDR59, CCNB1, PPP2R2C, CTPS1, ARL4C, CCT3, CCT6B, LONP1, BABAM2, GPSM2, GNAS, DIAPH1, UNC45B, CDC73, CAPZA2, DCTN2, DCTN6, SH3BP1, RAP1GDS1, FARP1, RIOK1, USP15, TRAPPC6B, ARPC1B, SH2D4A, GIGYF2, DPP9, STAT1, RNF146, OSBPL2, DBNL, UBE2D3, RPAP2, DSN1, MIOS, SKIC3, SKIC8, VBP1, FAM120A, RABGEF1, BBS4, RNF31, VCP, YKT6, ADSL, SNX9, ITPA, RABEP2, MARK4, GSK3A, MYO9B, MAP2K2, AIP, ELP1, CCDC43, ZNF598, USP25, CSNK1A1L, DAPK3, EIF2S2, SORBS3, CAMK2D, SKA3, PIDD1, TRIM11, RPL23, EIF4A2, SPDL1, PSMF1, PNMA1, RIC8B, SCGN, OTUD4, LURAP1, NAA10, HBS1L, NAA16, EPS8L1, PHKA1, CAPN1, IMPDH1, ATXN2L, KIAA0753, EIF4G3, EPRS1, WDR26, RAPGEF6, CAMKK1, MVP, CAPN2, MRTFA, PPP6R2, CSNK1A1, PARD6B, IKBKB, PSAT1, FGF13, SAPCD2, EPS15, USP10, EHBP1, STIL, PSME1, PASK, ABHD10, PIP4K2C, LARP1B, TPRKB, ABCE1, LAMTOR5, RABGAP1, OPTN, CAPNS2, ALAD, CAMK2B, AMOTL1, DIXDC1, ZC3HAV1, ELP2, ADCY9, CCHCR1, RFPL4A, SH3KBP1, DOK4, SHC1, FAM83G, ATXN2, QARS1, TYK2, TXLNG, CALCOCO1, CCDC6, URGCP, CRYAB, MAP4K5, AHCYL1, METTL13, AIRIM, CAMKK2, GSTT2B, MORC2, MSI2, IMPDH2, SARS1, KLHDC8B, LRCH3, TACC3, IKBKG, AMPD2, IKBKE, SPAG5, HSP90AA1, FTSJ1, CIT, FXR2, LDHA, RABL6, CAMSAP2, TRIM39, EIF4A1, DAAM1, TRAF2, PRRC2A, NCAPH, PSMD9, BUB1B, KCMF1, RPS24, EIF3E, ARHGEF10L, EIF3I, PUM2, RBMS1, RO60, STAT5A, SPC25, ZFYVE9, NXN, RPAP3, CCT2, PFDN5, MOV10, CCT6A, CCT7, SHB, PDCL3, PDCD5, PDCL, TXNDC9, CCT8, CCT4, NLRP2, EIF3B, EIF3C, EIF3D, EIF3H, EIF3J, EIF3K, EIF3M
cytoplasm	136	CCNB1, CHP1, CTPS1, ARL4C, NRBP2, BABAM2, DOK3, GNA12, GPSM2, FBXO45, DIAPH1, UNC45B, DCTN2, USP15, TRAPPC6B, SH2D4A, IFT81, STAT1, RNF146, DBNL, RPAP2, MIOS, SKIC3, SKIC8, VBP1, PRPSAP1, PDZRN3, NACA2, VCP, YKT6, SNX9, ITPA, MARK4, GSK3A, MYO9B, AIP, ELP1, ERC1, CSNK1A1L, DAPK3, EIF2S2, CAMK2D, PIDD1, TRIM11, RPL23, CAP1, PNMA1, RIC8B, SCGN, CDK3, LURAP1, NAA10, NAA16, CAPN1, IMPDH1, UBAP2, EPRS1, CRYGD, IQSEC2, WDR26, TLN2, VWA8, CAMKK1, MVP, CAPN2, MRTFA, CSNK1A1, IKBKB, AFG2A, PSAT1, FGF13, EPS15, USP10, STIL, PSME1, PASK, TPRKB, ABCE1, MON1B, OPTN, SMAP1, CAMK2B, RPS6KB2, DNAJB9, ELP2, CCDC103, RFPL4A, SH3KBP1, DOK4, ATXN2, QARS1, TYK2, NUMB, CRYAB, MAP4K5, AHCYL1, METTL13, AIRIM, GSTT2B, MORC2, PER3, MSI2, IMPDH2, SARS1, KLHDC8B, LRCH3, TACC3, IKBKG, MAGEA1, IKBKE, SPAG5, HSP90AA1, FTSJ1, FXR2, RABL6, TRIM39, EIF4A1, PSMD9, FAM83H, PRPSAP2, BUB1B, RPS24, EIF3E, PUM2, TSC22D4, PIH1D1, PFDN5, PFDN1, CCT6A, CCT7, PDCL3, PDCD5, PDCL, TXNDC9, CCT8, NLRP2
nucleus	104	CCNB1, CHP1, TLE3, ARL4C, BABAM2, MLLT10, FBXO45, DIAPH1, CDC73, SH3BP1, RAP1GDS1, USP15, ARPC1B, ZC3H7A, DPP9, STAT1, RNF146, UBE2D3, RPAP2, SKIC3, SKIC8, VBP1, FAM120A, BBS4, NACA2, VCP, ZNF213, FSD2, GSK3A, MAP2K2, ELP1, USP25, CSNK1A1L, DAPK3, EIF2S2, SORBS3, CAMK2D, PIDD1, ZNF263, PRR12, SPDL1, SCGN, CDK3, OTUD4, NAA10, NAA16, IMPDH1, TSPYL5, UBAP2, CRYGD, ZNF785, WDR26, MVP, CAPN2, MRTFA, PPP6R2, CSNK1A1, PARD6B, IKBKB, FGF13, USP10, PASK, LARP1B, TPRKB, OPTN, ALAD, ZC3HAV1, CCHCR1, FAM83G, TYK2, CALCOCO1, URGCP, CRYAB, INTS10, METTL13, AIRIM, MORC2, PER3, IMPDH2, SARS1, IKBKG, MAGEA1, IKBKE, HSP90AA1, CIT, FXR2, LDHA, RABL6, TRIM39, EIF4A1, PSMD9, RPS24, EIF3E, RBMS1, STAT5A, SPC25, TSC22D4, NXN, PIH1D1, PFDN5, MOV10, PDCD5, TXNDC9, EIF3K
nucleoplasm	61	CCNB1, TLE3, LONP1, BABAM2, MLLT10, CDC73, RIOK1, USP15, STAT1, RNF146, UBE2D3, RPAP2, DSN1, MIOS, SKIC3, SKIC8, VCP, ITPA, AIP, DAPK3, CAMK2D, PIDD1, TRIM11, RPL23, PSMF1, PNMA1, WDR26, CAMKK1, MRTFA, SAPCD2, USP10, EHBP1, STIL, PSME1, PIP4K2C, OPTN, CAMK2B, RPS6KB2, ELP2, RFPL4A, CRYAB, INTS10, AIRIM, CAMKK2, GSTT2B, MORC2, IKBKG, IKBKE, HSP90AA1, TRAF2, PRRC2A, NCAPH, PSMD9, RPS24, EIF3E, RO60, STAT5A, SHB, PDCL3, CCT8, CCT4
plasma membrane	51	CHP1, CPNE5, ARL4C, FAT4, PCDHA12, DOK3, GNA12, GNG2, DIAPH1, RNF146, DBNL, UBE2D3, FAM120A, STOM, YKT6, SNX9, AIP, CAP1, RIC8B, RRAS, EPS8L1, PHKA1, CAPN1, EPRS1, TLN2, RAPGEF6, CAPN2, PARD6B, FGF13, EPS15, EHBP1, SDK1, PIP4K2C, MRAS, SMAP1, CAPNS2, AMOTL1, ADCY9, SH3KBP1, SHC1, LRRC4C, NUMB, MAP4K5, IL1RAP, MAGEA1, BFSP2, HSP90AA1, DAAM1, PRRC2A, KCMF1, SHB
extracellular exosome	50	CHP1, CPNE5, CCT3, FAT4, GNG2, GNAS, CAPZA2, DCTN2, RAP1GDS1, ARPC1B, DBNL, UBE2D3, STOM, VCP, SNX9, RPL23, CAP1, RRAS, HBS1L, NAA16, EPS8L1, CAPN1, MVP, CAPN2, PARD6B, PSAT1, PSME1, PIP4K2C, ALAD, DNAJB9, TYK2, CRYAB, AHCYL1, GSTT2B, IMPDH2, SARS1, HSP90AA1, LDHA, EIF4A1, PRRC2A, EIF3E, EIF3I, CCT2, CCT6A, CCT7, PDCD5, CCT8, CCT4, EIF3B, EIF3H
ATP binding	47	CTPS1, NRBP2, CCT3, CCT6B, LONP1, RIOK1, UBE2D3, VCP, MARK4, GSK3A, MYO9B, MAP2K2, CSNK1A1L, DAPK3, CAMK2D, EIF4A2, CDK3, EPRS1, VWA8, CAMKK1, CSNK1A1, IKBKB, AFG2A, PASK, PIP4K2C, ABCE1, CAMK2B, RPS6KB2, ADCY9, QARS1, TYK2, MAP4K5, CAMKK2, MORC2, SARS1, IKBKE, HSP90AA1, CIT, EIF4A1, BUB1B, CCT2, MOV10, CCT6A, CCT7, CCT8, CCT4, NLRP2
membrane	46	CCNB1, CTPS1, LONP1, GNG2, GNAS, CAPZA2, DCTN2, GIGYF2, OSBPL2, DBNL, FAM120A, STOM, AP3D1, MYO9B, CAMK2D, SNX11, RPL23, PSMF1, NAA10, HBS1L, CAPN1, ATXN2L, EPRS1, MVP, CSNK1A1, EPS15, ABCE1, ADCY9, ATXN2, LAYN, LRRC4C, IL1RAP, IMPDH2, HSP90AA1, CIT, FXR2, LDHA, EIF4A1, DAAM1, PRRC2A, NCAPH, RPS24, EIF3E, EIF3D, EIF3H, EIF3K
identical protein binding	44	CTPS1, BLTP3A, LONP1, GPSM2, DCTN2, USP15, DPP9, STAT1, STOM, PRPSAP1, RNF31, VCP, ADSL, SNX9, ITPA, DAPK3, CAMK2D, EPRS1, MVP, IKBKB, PSAT1, STIL, SDK1, PIP4K2C, OPTN, ALAD, CAMK2B, AMOTL1, CCDC6, CRYAB, AHCYL1, MSI2, IMPDH2, IKBKG, IKBKE, HSP90AA1, FXR2, LDHA, TRIM39, DAAM1, TRAF2, PRPSAP2, KCTD21, EIF3J
RNA binding	40	CCT3, DIAPH1, GIGYF2, ZC3H7A, FAM120A, VCP, ZNF598, EIF2S2, RPL23, EIF4A2, OTUD4, IMPDH1, ATXN2L, UBAP2, EIF4G3, USP10, LARP1B, ZC3HAV1, ATXN2, AHCYL1, MSI2, IMPDH2, HSP90AA1, FXR2, EIF4A1, PRRC2A, RPS24, EIF3E, EIF3I, PUM2, RBMS1, RO60, MOV10, CCT6A, CCT4, EIF3B, EIF3C, EIF3D, EIF3H, EIF3K
metal ion binding	34	CIAO3, CPNE5, GNA12, MLLT10, GNAS, RIOK1, ZC3H7A, RPAP2, RNF31, HDDC3, ZNF213, ITPA, MAP2K2, ZNF598, EIF2S2, ZNF263, IMPDH1, KIAA0753, ZNF785, RNF214, OPTN, SMAP1, ZC3HAV1, ADCY9, RFPL4A, CALCOCO1, CRYAB, VPS11, IMPDH2, IKBKG, AMPD2, CIT, RO60, ZFYVE9
centrosome	21	CCNB1, GPSM2, DCTN2, DCTN6, IFT81, BBS4, RABEP2, MARK4, ERC1, SKA3, RIC8B, KIAA0753, RAPGEF6, CSNK1A1, STIL, RABGAP1, RABL6, CAMSAP2, TXNDC9, CCT8, CCT4
extracellular region	21	FBXO45, MFAP4, CAPZA2, DBNL, DSN1, VCP, OSTF1, MAP2K2, CAP1, SCGN, CAPN1, IMPDH1, MVP, ALAD, CCDC103, IL1RAP, IMPDH2, HSP90AA1, KCMF1, CCT2, CCT8
mitochondrion	20	TUSC2, LONP1, RAP1GDS1, USP15, STOM, YKT6, GSK3A, MAP2K2, CAPN1, WDR26, VWA8, AFG2A, ABHD10, ABCE1, CRYAB, BBC3, METTL13, HSP90AA1, LDHA, TRIM39
signal transduction	20	TLE3, BABAM2, RABEP2, OSTF1, CSNK1A1L, PIDD1, CAP1, CDK3, HBS1L, CSNK1A1, FGF13, OPTN, CAMK2B, RPS6KB2, ADCY9, CALCOCO1, TRAF2, FAM83H, SHB, PDCL
protein phosphorylation	19	CCNB1, NRBP2, RABGEF1, MARK4, GSK3A, DAPK3, CAMK2D, CDK3, CAMKK1, CSNK1A1, IKBKB, PASK, CAMK2B, RPS6KB2, TYK2, MAP4K5, CAMKK2, IKBKE, CIT
protein stabilization	19	CHP1, CCT3, VBP1, RPL23, NAA16, CRYAB, PER3, HSP90AA1, TRIM39, PIH1D1, RPAP3, CCT2, PFDN5, PFDN1, CCT6A, CCT7, PDCL3, CCT8, CCT4
ATP hydrolysis activity	18	CCT3, CCT6B, LONP1, VCP, MYO9B, EIF4A2, VWA8, AFG2A, ABCE1, MORC2, HSP90AA1, EIF4A1, CCT2, MOV10, CCT6A, CCT7, CCT8, CCT4
protein serine kinase activity	18	RIOK1, MARK4, GSK3A, MAP2K2, CSNK1A1L, DAPK3, CAMK2D, CDK3, CAMKK1, CSNK1A1, IKBKB, PASK, CAMK2B, RPS6KB2, MAP4K5, CAMKK2, CIT, BUB1B
protein homodimerization activity	18	STAT1, STOM, SNX9, MYO9B, DAPK3, CAMK2D, PSMF1, EPRS1, IKBKB, CAMK2B, CCDC103, RFPL4A, CRYAB, MORC2, SARS1, IKBKG, HSP90AA1, FXR2
cell division	17	CCNB1, BABAM2, GPSM2, DSN1, MARK4, SKA3, SPDL1, CDK3, CSNK1A1, PARD6B, ZNRD2, TACC3, SPAG5, NCAPH, BUB1B, SPC25, SYCE1
protein serine/threonine kinase activity	17	NRBP2, RIOK1, MARK4, GSK3A, MAP2K2, CSNK1A1L, DAPK3, CAMK2D, CSNK1A1, IKBKB, PASK, RPS6KB2, MAP4K5, CAMKK2, IKBKE, CIT, BUB1B
protein-containing complex	17	MLLT10, GPSM2, GIGYF2, STAT1, VCP, ADSL, RPL23, EPS8L1, USP10, LAMTOR5, DIXDC1, QARS1, CRYAB, IKBKG, HSP90AA1, ZFYVE9, PDCL3
intracellular membrane-bounded organelle	16	WDR59, OSBPL2, DBNL, VBP1, VCP, ITPA, RABEP2, LURAP1, PPP6R2, EPS15, CALCOCO1, MSI2, TACC3, CCZ1B, ZFYVE9, NLRP2
focal adhesion	16	CHP1, GNA12, ARPC1B, MAP2K2, SORBS3, RPL23, CAP1, RRAS, CAPN1, TLN2, CAPN2, DIXDC1, SH3KBP1, SHC1, LAYN, NUMB
 transcription by RNA polymerase II	16	MLLT10, CDC73, STAT1, RPAP2, AP3D1, ZNF213, GSK3A, CAMK2D, ZNF263, MRTFA, IKBKB, ELP2, CALCOCO1, IKBKG, STAT5A, TSC22D2
perinuclear region of cytoplasm	16	UNC45B, STAT1, STOM, VCP, FSD2, MYO9B, MAP2K2, EIF4A2, PSMF1, MVP, OPTN, ATXN2, HSP90AA1, BUB1B, PUM2, PDCL3
cadherin binding	16	GIGYF2, STAT1, DBNL, YKT6, SNX9, ERC1, EPS8L1, ATXN2L, UBAP2, EPS15, ZC3HAV1, NUMB, LDHA, EIF3E, TXNDC9, CCT8
endoplasmic reticulum	15	CHP1, RAP1GDS1, TRAPPC6B, GIGYF2, STOM, VCP, YKT6, MAP2K2, USP25, PSMF1, CAPN2, PIP4K2C, DNAJB9, RPS24, PDCL3
 translation	15	ELP1, ZNF598, HBS1L, EIF4G3, PASK, LARP1B, ABCE1, ELP2, ATXN2, MSI2, FXR2, EIF3E, PUM2, EIF3C, EIF3D
unfolded protein binding	14	CCT3, CCT6B, VBP1, NACA2, AIP, CRYAB, HSP90AA1, CCT2, PFDN5, PFDN1, CCT6A, CCT7, CCT8, CCT4
apoptotic process	14	BABAM2, UBE2D3, DAPK3, PIDD1, SH3KBP1, AHCYL1, BBC3, IKBKG, TRIM39, BUB1B, SHB, PDCL3, PDCD5, NLRP2
synapse	14	FBXO45, ERC1, EIF2S2, RPL23, SCGN, TLN2, SDK1, CAMK2B, SH3KBP1, KCMF1, EIF3I, TSC22D4, EIF3B, EIF3D
translational initiation	14	EIF2S2, EIF4A2, EIF4G3, ABCE1, EIF4A1, EIF3E, EIF3I, EIF3B, EIF3C, EIF3D, EIF3H, EIF3J, EIF3K, EIF3M
protein kinase binding	13	CCNB1, DCTN2, MVP, IKBKB, TPRKB, ELP2, RFPL4A, FAM83G, QARS1, CIT, TRAF2, FAM83H, PIH1D1
protein folding	13	CCT3, CCT6B, VBP1, CRYAB, HSP90AA1, CCT2, PFDN5, PFDN1, CCT6A, CCT7, PDCL3, CCT8, CCT4
 DNA-templated transcription	13	STAT1, MAP2K2, AIP, ERC1, DAPK3, ZNF263, NAA16, IKBKB, SHC1, CALCOCO1, CAMKK2, PSMD9, PFDN5
nucleolus	13	STAT1, RPAP2, DSN1, RABGEF1, PIDD1, RPL23, PNMA1, NAA10, SAPCD2, DNAJB9, AIRIM, RPS24, PIH1D1
ubiquitin protein ligase binding	13	UBE2D3, RNF31, VCP, SNX9, USP25, RPL23, SH3KBP1, PER3, IKBKG, IKBKE, HSP90AA1, TRAF2, CCT2
translation initiation factor activity	13	EIF2S2, EIF4A2, EIF4G3, EIF4A1, EIF3E, EIF3I, EIF3B, EIF3C, EIF3D, EIF3H, EIF3J, EIF3K, EIF3M
 gene expression	12	CIAO3, GSK3A, MAP2K2, TRIM11, RPL23, CDK3, UBAP2, LAMTOR5, CALCOCO1, RO60, PDCL3, PDCD5
negative regulation of transcription by RNA polymerase II	12	CDC73, STAT1, UBE2D3, SORBS3, RPL23, ZNF263, ZNF785, METTL13, PER3, SARS1, MAGEA1, TSC22D4
ubiquitin protein ligase activity	12	RNF146, UBE2D3, RABGEF1, RNF31, PDZRN3, ZNF598, TRIM11, GID4, RFPL4A, VPS11, TRIM39, KCMF1
microtubule	11	CCT3, DCTN2, DPP9, GSK3A, MAP2K2, FGF13, CCT2, CCT6A, CCT7, CCT8, CCT4
Golgi apparatus	11	GIGYF2, AP3D1, YKT6, MAP2K2, PIDD1, CAPN2, OPTN, ATXN2, CRYAB, CAMSAP2, NLRP2
zinc ion binding	11	RNF146, RABGEF1, PDZRN3, MYO9B, TRIM11, EPRS1, ALAD, MORC2, TRIM39, TRAF2, KCMF1
ficolin-1-rich granule lumen	11	DBNL, VCP, OSTF1, CAPN1, IMPDH1, MVP, ALAD, IMPDH2, HSP90AA1, KCMF1, CCT8
 I-kappaB kinase/NF-kappaB signaling	11	RNF31, PIDD1, LURAP1, IKBKB, LAMTOR5, OPTN, WDR83, RFPL4A, IKBKG, IKBKE, TRAF2
Wnt signaling pathway	10	TLE3, CDC73, RNF146, SKIC8, GSK3A, CSNK1A1L, CSNK1A1, AMOTL1, CALCOCO1, NXN
actin binding	10	DIAPH1, DBNL, MYO9B, CAP1, EPS8L1, TLN2, MRTFA, CAMK2B, DIXDC1, DAAM1
actin cytoskeleton organization	10	DIAPH1, CAPZA2, IQSEC2, MRTFA, MRAS, AMOTL1, SHC1, DAAM1, ARHGEF10L, PDCL3
dendrite	10	FARP1, STAT1, DBNL, RABGEF1, MARK4, SCGN, CAPN2, FGF13, ADCY9, TSC22D4
formation of cytoplasmic translation initiation complex	10	EIF2S2, EIF3E, EIF3I, EIF3B, EIF3C, EIF3D, EIF3H, EIF3J, EIF3K, EIF3M
innate immune response	10	TRIM11, OTUD4, IKBKB, OPTN, ZC3HAV1, RFPL4A, IL1RAP, IKBKG, TRAF2, NLRP2
calcium ion binding	9	CHP1, FAT4, PCDHA12, SCGN, CAPN1, CAPN2, EPS15, CAPNS2, CAMKK2
cell differentiation	9	CPNE5, GNA12, UNC45B, AFG2A, CAMK2B, CCHCR1, TYK2, PRRC2A, NXN
neuron projection	9	CPNE5, GNA12, MARK4, CAMK2D, PRR12, FGF13, CAMK2B, SH3KBP1, CAMKK2
GTP binding	9	ARL4C, GNA12, GNAS, RRAS, HBS1L, MRAS, URGCP, HSP90AA1, RABL6
protein folding chaperone	9	CCT3, CCT6B, CCT2, PFDN1, CCT6A, CCT7, PDCL3, CCT8, CCT4
cytoskeleton	9	CCT3, FARP1, STOM, SORBS3, MVP, DIXDC1, SH3KBP1, TYK2, CCDC6
ubiquitin-dependent protein catabolic process	9	FBXO45, USP15, RNF146, UBE2D3, USP25, PSMF1, USP10, PSMD9, KCTD21
protein ubiquitination	9	FBXO45, UBE2D3, PDZRN3, VCP, ZNF598, TRIM11, VPS11, TRIM39, KCTD21
small GTPase binding	9	DIAPH1, FARP1, RABGEF1, MYO9B, ERC1, DAPK3, RAPGEF6, RABGAP1, DAAM1
guanyl-nucleotide exchange factor activity	9	RAP1GDS1, FARP1, RABGEF1, RIC8B, EPS8L1, IQSEC2, RAPGEF6, LAMTOR5, ARHGEF10L
cytoplasmic stress granule	9	GIGYF2, VCP, ATXN2L, LARP1B, ATXN2, FXR2, PUM2, MOV10, EIF3B
ciliary basal body	9	IFT81, BBS4, RABEP2, MARK4, ERC1, CSNK1A1, SPAG5, CAMSAP2, DAAM1
early endosome	9	DBNL, RABGEF1, AP3D1, RABEP2, MAP2K2, USP10, NUMB, VPS11, ZFYVE9
secretory granule lumen	9	DBNL, VCP, OSTF1, IMPDH1, MVP, ALAD, IMPDH2, HSP90AA1, CCT8
 NF-kappaB transcription factor activity	9	RNF31, ERC1, PIDD1, IKBKB, LAMTOR5, RFPL4A, IL1RAP, IKBKG, TRAF2
intracellular signal transduction	9	MARK4, DAPK3, CAMKK1, CORO2A, PASK, ADCY9, SHC1, TYK2, MAP4K5
eukaryotic translation initiation factor 3 complex	9	EIF3E, EIF3I, EIF3B, EIF3C, EIF3D, EIF3H, EIF3J, EIF3K, EIF3M
eukaryotic 43S preinitiation complex	9	EIF3E, EIF3I, EIF3B, EIF3C, EIF3D, EIF3H, EIF3J, EIF3K, EIF3M
eukaryotic 48S preinitiation complex	9	EIF3E, EIF3I, EIF3B, EIF3C, EIF3D, EIF3H, EIF3J, EIF3K, EIF3M
GTPase activity	8	ARL4C, GNA12, GNAS, RRAS, HBS1L, MRAS, ABCE1, RABL6
ATP-dependent protein folding chaperone	8	CCT3, CCT6B, HSP90AA1, CCT2, CCT6A, CCT7, CCT8, CCT4
chaperone-mediated protein folding	8	CCT3, UNC45B, CCT2, CCT6A, CCT7, PDCL3, CCT8, CCT4
DNA damage response	8	BABAM2, FBXO45, VCP, PIDD1, CDK3, USP10, MORC2, IKBKG
neuronal cell body	8	GNA12, YKT6, GSK3A, CAPN2, DIXDC1, HSP90AA1, CIT, FXR2
protein domain specific binding	8	GPSM2, DBNL, VCP, TRIM11, DIXDC1, VPS11, IKBKG, ZFYVE9
proteasome-mediated ubiquitin-dependent protein catabolic process	8	FBXO45, UBE2D3, VCP, GSK3A, PSMF1, GID4, WDR26, CSNK1A1
glutamatergic synapse	8	FBXO45, FARP1, DBNL, AP3D1, VCP, LRRC4C, NUMB, IL1RAP
endocytosis	8	NECAP2, DBNL, SNX9, RABEP2, EPS15, EHBP1, SH3KBP1, ZFYVE9
protein transport	8	NECAP2, BBS4, YKT6, RABEP2, ERC1, MVP, EPS15, EHBP1
kinetochore	8	DCTN2, DCTN6, DSN1, SKA3, CSNK1A1, SPAG5, BUB1B, SPC25
 apoptotic process	8	STAT1, VCP, DAPK3, PIDD1, PNMA1, HSP90AA1, TRAF2, PDCD5
response to hypoxia	7	CIAO3, LONP1, ADSL, CAPN2, ALAD, WDR83, CRYAB
mitotic spindle organization	7	CCNB1, GPSM2, DCTN2, DCTN6, STIL, TACC3, SPC25
cell cycle	7	TUSC2, CDC73, MARK4, CSNK1A1, RABGAP1, TXLNG, URGCP
negative regulation of DNA-templated transcription	7	TLE3, TRIM11, SHC1, QARS1, CRYAB, TSC22D4, PFDN5
chaperonin-containing T-complex	7	CCT3, CCT6B, CCT2, CCT6A, CCT7, CCT8, CCT4
nervous system development	7	PCDHA12, TRAPPC6B, MARK4, GSK3A, FGF13, CAMK2B, DOK4
negative regulation of apoptotic process	7	BABAM2, CDC73, PIDD1, NAA16, STIL, SHC1, CRYAB
cell cortex	7	GPSM2, DBNL, MYO9B, RIC8B, PARD6B, BFSP2, TRAF2
protein-containing complex assembly	7	CAPZA2, SNX9, EPRS1, PARD6B, IL1RAP, IKBKG, TRAF2
 cell population proliferation	7	STAT1, RPL23, CAPN1, TSPYL5, SAPCD2, SHC1, STAT5A
ubiquitin-protein transferase activity	7	RNF146, UBE2D3, RNF31, PDZRN3, TRIM11, RNF214, TRAF2
peptidyl-serine phosphorylation	7	GSK3A, CSNK1A1L, CAMK2D, CSNK1A1, IKBKB, CAMK2B, IKBKE
calmodulin binding	7	MYO9B, CAMK2D, PHKA1, CAMKK1, CAMK2B, CAMKK2, CAMSAP2
mRNA binding	7	EIF2S2, ATXN2L, EIF4G3, ATXN2, MSI2, HSP90AA1, EIF4A1
 translational initiation	7	EIF4A2, EIF4G3, RPS6KB2, EIF3E, EIF3B, EIF3H, EIF3K
lysosomal membrane	6	WDR59, MIOS, AP3D1, LAMTOR5, VPS11, CCZ1B
molecular adaptor activity	6	CCNB1, OTUD4, LAMTOR5, SARS1, TRAF2, EIF3B
in utero embryonic development	6	CCNB1, GNA12, EIF2S2, STIL, ADCY9, NXN
mitochondrial matrix	6	CCNB1, LONP1, ABHD10, ABCE1, SHC1, QARS1
Golgi membrane	6	CHP1, DBNL, AP3D1, YKT6, ERC1, OPTN
 telomere maintenance via telomerase	6	CCT3, CCT2, CCT6A, CCT7, CCT8, CCT4
toxin transport	6	CCT3, CCT6B, CCT2, CCT7, CCT8, CCT4
 establishment of protein localization to telomere	6	CCT3, CCT2, CCT6A, CCT7, CCT8, CCT4
 protein localization to Cajal body	6	CCT3, CCT2, CCT6A, CCT7, CCT8, CCT4
 telomerase RNA localization to Cajal body	6	CCT3, CCT2, CCT6A, CCT7, CCT8, CCT4
Ras protein signal transduction	6	DOK3, RABGEF1, RRAS, RAPGEF6, MRAS, DOK4
DNA binding	6	MLLT10, RABGEF1, IMPDH1, ZNF785, IMPDH2, PDCD5
postsynaptic density	6	FBXO45, DBNL, PRR12, CRYAB, FXR2, EIF3E
apical plasma membrane	6	GNAS, RAPGEF6, PARD6B, SAPCD2, AHCYL1, HSP90AA1
 cell migration	6	DIAPH1, DAPK3, PARD6B, AMOTL1, NUMB, FAM83H
actin filament binding	6	CAPZA2, ARPC1B, DBNL, MYO9B, TLN2, CORO2A
GTPase activator activity	6	SH3BP1, RABEP2, MYO9B, RABGAP1, SMAP1, ARHGEF10L
SH3 domain binding	6	SH3BP1, OSTF1, EPS15, SH3KBP1, CCDC6, CIT
 GTPase activity	6	SH3BP1, RAP1GDS1, TRAPPC6B, SNX9, RAPGEF6, RABGAP1
RNA polymerase II cis-regulatory region sequence-specific DNA binding	6	STAT1, ZNF213, ZNF263, CALCOCO1, SARS1, STAT5A
axon	6	STAT1, GSK3A, FGF13, ADCY9, CRYAB, FXR2
azurophil granule lumen	6	DSN1, VCP, CAP1, IMPDH1, CCT2, CCT8
rescue of stalled ribosome	6	SKIC3, SKIC8, ZNF598, HBS1L, USP10, ABCE1
protein phosphatase binding	6	VCP, MVP, PPP6R2, IKBKE, HSP90AA1, TRAF2
 autophagy	6	GSK3A, DAPK3, USP10, PIP4K2C, OPTN, RFPL4A
lysosome	6	CAPN1, CAPN2, LAMTOR5, CRYAB, VPS11, BBC3
ribonucleoprotein complex	6	EPRS1, MVP, ATXN2, RBMS1, RO60, PIH1D1
inflammatory response	5	TUSC2, IKBKB, IL1RAP, IKBKG, NLRP2
microtubule binding	5	CHP1, MARK4, FGF13, CRYAB, SPAG5
membrane raft	5	CHP1, STOM, CAPN2, IKBKB, TRAF2
response to xenobiotic stimulus	5	CTPS1, GNA12, STAT1, ALAD, HSP90AA1
negative regulation of canonical Wnt signaling pathway	5	TLE3, GSK3A, CSNK1A1L, CSNK1A1, PFDN5
intracellular protein transport	5	ARL4C, AP3D1, SNX9, SNX11, VPS11
binding of sperm to zona pellucida	5	CCT3, CCT2, CCT7, CCT8, CCT4
cell body	5	CCT3, CCT2, CCT7, CCT8, CCT4
protein autoubiquitination	5	BABAM2, RNF146, UBE2D3, TRIM11, TRAF2
 MAPK cascade	5	DOK3, MAP2K2, SORBS3, DOK4, SHC1
 proteasomal ubiquitin-dependent protein catabolic process	5	GNA12, VCP, GSK3A, CSNK1A1, ZER1
chromatin binding	5	MLLT10, TSPYL5, CALCOCO1, MORC2, NCAPH
histone binding	5	MLLT10, STAT1, TSPYL5, MORC2, PIH1D1
nucleotide binding	5	GPSM2, ITPA, IMPDH1, VPS11, IMPDH2
transmembrane transporter binding	5	DIAPH1, CAMK2D, FGF13, USP10, HSP90AA1
cytoskeleton organization	5	DIAPH1, SORBS3, TLN2, SH3KBP1, CCDC6
microtubule organizing center	5	DIAPH1, MARK4, SPDL1, CAMK2B, BUB1B
mitotic spindle	5	DIAPH1, SKA3, TACC3, IKBKG, SPAG5
protein localization to centrosome	5	DCTN2, BBS4, KIAA0753, STIL, SPAG5
structural constituent of cytoskeleton	5	ARPC1B, SORBS3, TLN2, CCDC6, BFSP2
endosome	5	GIGYF2, YKT6, SNX11, EHBP1, VPS11
centriole	5	IFT81, BBS4, KIAA0753, STIL, CCHCR1
cilium	5	IFT81, BBS4, CSNK1A1, PDCL, CCT8
enzyme binding	5	STAT1, SPDL1, CAPN2, SARS1, TRAF2
chromatin	5	STAT1, TSPYL5, CAPN2, CALCOCO1, STAT5A
ruffle	5	DBNL, SNX9, MYO9B, TLN2, LAYN
ubiquitin ligase complex	5	UBE2D3, GID4, WDR26, IKBKG, TRAF2
endosome membrane	5	UBE2D3, AP3D1, WDR83, NUMB, VPS11
protein-macromolecule adaptor activity	5	BBS4, TRIM11, OPTN, VPS11, TRAF2
microtubule cytoskeleton organization	5	BBS4, MARK4, TACC3, CAMSAP2, TXNDC9
cytoplasmic side of plasma membrane	5	RNF31, MAP2K2, IKBKB, TYK2, TRAF2
midbody	5	MARK4, KLHDC8B, SPAG5, CIT, TXNDC9
MAPK cascade	5	MAP2K2, SORBS3, FGF13, MAP4K5, CAMKK2
ribosome binding	5	ZNF598, NAA10, NAA16, EIF3C, EIF3K
cytosolic ribosome	5	ZNF598, RPL23, HBS1L, ABCE1, RPS24
protein autophosphorylation	5	DAPK3, CAMK2D, PASK, CAMK2B, CAMKK2
translation initiation factor binding	5	EIF2S2, RPS24, EIF3B, EIF3C, EIF3M
translation	5	RPL23, HBS1L, RPS6KB2, SARS1, RPS24
response to virus	5	YJU2B, IKBKB, LAMTOR5, ZC3HAV1, IKBKG
protein kinase activity	5	CSNK1A1, IKBKB, RPS6KB2, MAP4K5, BUB1B
eukaryotic translation initiation factor 3 complex, eIF3m	5	EIF3I, EIF3B, EIF3D, EIF3H, EIF3M
 TOR signaling	4	WDR59, GNA12, MIOS, LAMTOR5
 TORC1 signaling	4	WDR59, MIOS, LAMTOR5, PIH1D1
spindle pole	4	CCNB1, SPDL1, TACC3, IKBKG
outer kinetochore	4	CCNB1, SKA3, SPDL1, BUB1B
perikaryon	4	CPNE5, GIGYF2, DBNL, CRYAB
histone deacetylase binding	4	BLTP3A, MAGEA1, HSP90AA1, KCTD21
zona pellucida receptor complex	4	CCT3, CCT2, CCT8, CCT4
cell adhesion	4	PCDHA12, MFAP4, SORBS3, TLN2
polyubiquitin modification-dependent protein binding	4	BABAM2, VCP, EPS15, OPTN
G protein-coupled receptor signaling pathway	4	GNA12, GPSM2, GNG2, RIC8B
 cell shape	4	GNA12, DIAPH1, DAPK3, SH3KBP1
neuron migration	4	FBXO45, BBS4, FGF13, HSP90AA1
extracellular space	4	MFAP4, STOM, LRRC4C, MOV10
vesicle-mediated transport	4	NECAP2, AP3D1, MON1B, CCZ1B
clathrin-coated pit	4	NECAP2, SNX9, EPS15, NUMB
actin cytoskeleton	4	CAPZA2, ARPC1B, MYO9B, TLN2
cell migration	4	SH3BP1, GSK3A, SPDL1, SH3KBP1
bicellular tight junction	4	SH3BP1, PARD6B, SAPCD2, AMOTL1
cysteine-type deubiquitinase activity	4	USP15, USP25, OTUD4, USP10
protein deubiquitination	4	USP15, USP25, OTUD4, USP10
nuclear body	4	USP15, DSN1, SPAG5, RO60
trans-Golgi network	4	TRAPPC6B, SNX9, OPTN, ATXN2
negative regulation of translation	4	GIGYF2, DAPK3, EPRS1, FXR2
cilium assembly	4	IFT81, BBS4, KIAA0753, RO60
motile cilium	4	IFT81, BBS4, CCDC103, DAAM1
proteolysis	4	DPP9, USP25, CAPN1, CAPN2
DNA-binding transcription factor activity, RNA polymerase II-specific	4	STAT1, ZNF213, ZNF263, STAT5A
negative regulation of I-kappaB kinase/NF-kappaB signaling	4	STAT1, USP10, OPTN, TRIM39
defense response to virus	4	STAT1, ZC3HAV1, IKBKE, MOV10
 protein targeting to mitochondrion	4	UBE2D3, RNF31, GSK3A, VPS11
amyloid-beta binding	4	VBP1, CRYAB, PFDN5, PFDN1
negative regulation of amyloid fibril formation	4	VBP1, CRYAB, PFDN5, PFDN1
polysome	4	VBP1, ATXN2, MSI2, FXR2
endocytic vesicle	4	RABGEF1, RAPGEF6, SH3KBP1, VPS11
visual perception	4	BBS4, CRYGD, BFSP2, PDCL
 cilium assembly	4	BBS4, RABEP2, MARK4, RABGAP1
centriolar satellite	4	BBS4, KIAA0753, TACC3, SPAG5
K63-linked polyubiquitin modification-dependent protein binding	4	RNF31, OPTN, IKBKG, IKBKE
T cell receptor signaling pathway	4	RNF31, IKBKB, IKBKG, SHB
autophagy	4	VCP, USP10, OPTN, VPS11
 protein-containing complex assembly	4	VCP, IKBKE, HSP90AA1, TRAF2
 protein catabolic process	4	VCP, GSK3A, VPS11, HSP90AA1
scaffold protein binding	4	MAP2K2, IKBKB, HSP90AA1, CIT
transcription coactivator activity	4	AIP, MRTFA, CALCOCO1, PSMD9
calmodulin-dependent protein kinase activity	4	CAMK2D, CAMKK1, CAMK2B, CAMKK2
cytoplasmic translation	4	RPL23, SARS1, FTSJ1, RPS24
cytoplasmic translational initiation	4	EIF4A2, EIF4A1, EIF3I, EIF3M
protein heterodimerization activity	4	PSMF1, IKBKB, IKBKG, FXR2
protein-containing complex binding	4	RRAS, CAPN2, CRYAB, TRAF2
angiogenesis	4	AMOTL1, SHC1, SHB, PDCL3
immune response	4	TYK2, IL1RAP, IKBKG, IKBKE
ubiquitin-like protein ligase binding	3	CCNB1, STAT1, VCP
mitotic metaphase plate congression	3	CCNB1, DCTN2, SPDL1
 mitotic cell cycle	3	CCNB1, DAPK3, SHB
protein phosphatase regulator activity	3	PPP2R2C, GNA12, PPP6R2
negative regulation of protein kinase activity	3	CHP1, QARS1, SHB
protein export from nucleus	3	CHP1, CCHCR1, AHCYL1
microtubule cytoskeleton	3	CHP1, MARK4, CRYAB
nucleobase-containing compound metabolic process	3	CTPS1, PRPSAP1, PRPSAP2
late endosome	3	BLTP3A, MAP2K2, VPS11
filopodium	3	ARL4C, FARP1, FGF13
homophilic cell adhesion via plasma membrane adhesion molecules	3	FAT4, PCDHA12, SDK1
cerebral cortex development	3	FAT4, BBS4, TACC3
ADP binding	3	LONP1, VCP, MYO9B
sequence-specific DNA binding	3	LONP1, ZNF263, CALCOCO1
negative regulation of insulin receptor signaling pathway	3	LONP1, GSK3A, PIP4K2C
chaperone-mediated protein complex assembly	3	LONP1, HSP90AA1, CCT2
tumor necrosis factor receptor binding	3	BABAM2, STAT1, TRAF2
protein K63-linked deubiquitination	3	BABAM2, USP25, OTUD4
Rho protein signal transduction	3	GNA12, MYO9B, EPS8L1
heterotrimeric G-protein complex	3	GNA12, GNG2, GNAS
lateral plasma membrane	3	GNA12, GPSM2, FGF13
establishment of mitotic spindle orientation	3	GPSM2, SPDL1, SAPCD2
 mitotic spindle organization	3	GPSM2, STIL, TACC3
 spindle assembly	3	GPSM2, STIL, SPAG5
protein K48-linked ubiquitination	3	FBXO45, RNF146, UBE2D3
